{
  "schemaVersion": "1.0.0",
  "note": "执行面板。此前为交接书 §13.1 + §13.1.1 两张 markdown 表，现外置。lifecycle 与 authority 必须独立记录，不能混写为单一“状态”。claim 只用于并发协调，不构成 Evidence，也不提升 authority。",
  "enums": {
    "lifecycle": [
      "ready",
      "active",
      "completed",
      "blocked",
      "superseded",
      "deferred"
    ],
    "authority": [
      "unsupported",
      "candidate",
      "fixture-confirmed",
      "partial",
      "native-verified",
      "unverified"
    ]
  },
  "slices": [
    {
      "sliceId": "W-A-RECOVERY-01",
      "targetRelease": "V0.5",
      "lifecycle": "completed",
      "authority": "partial",
      "authorityCap": "partial",
      "authorityCapNote": "cap=partial；只提升已覆盖 writer 的恢复可信度",
      "capabilityIds": [
        "A-RECOVERY"
      ],
      "blockerRefs": [],
      "goal": "已完成公共四类 writer 与注册 BND4 writer 的 stage/validate/commit-backup/re-read 故障矩阵；本切片不再无限扩展",
      "hardPrerequisites": "不改变 Patch Engine 主干；既有私有运行只保留原证据边界",
      "entryPoints": [
        "packages/core/src/patch/durablePatchCommit.ts",
        "packages/core/src/transactions/workspaceTransaction.ts"
      ],
      "requiredValidation": "npm run test:writer-failure-matrix、既有 test:native-writer-failure-matrix 记录",
      "declaresUnfrozenValidation": false
    },
    {
      "sliceId": "W-A-RECOVERY-HARNESS-02",
      "targetRelease": "V0.5",
      "lifecycle": "completed",
      "authority": "fixture-confirmed",
      "authorityCap": "fixture-confirmed",
      "authorityCapNote": "cap=fixture-confirmed；只证明公开故障编排与 client/staging 失败关闭",
      "capabilityIds": [
        "A-RECOVERY"
      ],
      "blockerRefs": [],
      "goal": "已建立不加载 native 资产的 deterministic Bridge recovery/staging harness，覆盖四阶段故障、出站失败、注册期取消、超时、取消、同步/异步 progress、终态竞态、背压、进程退出、显式重启和 11 个代表性不安全 staging path segment case",
      "hardPrerequisites": "复用受控 subprocess 与系统临时目录；fake child 不得写成 native writer 通过",
      "entryPoints": [
        "packages/core/src/bridge/bridgeDaemonClient.ts",
        "packages/core/src/editing/bridgeStaging.ts",
        "packages/core/src/testing/bridgeRecoveryHarnessProtocol.ts",
        "packages/core/src/testing/bridgeRecoveryFixtureDaemon.ts",
        "packages/core/src/testing/runBridgeRecoveryHarnessSmoke.ts"
      ],
      "requiredValidation": "npm run test:bridge-recovery-harness、npm run test:bridge-staging、npm run bridge:verify:client",
      "declaresUnfrozenValidation": false
    },
    {
      "sliceId": "W-A-RECOVERY-NATIVE-02",
      "targetRelease": "V0.5",
      "lifecycle": "completed",
      "authority": "partial",
      "authorityCap": "partial",
      "authorityCapNote": "cap=partial；仅提升实际覆盖 writer，不外推到全部 writer",
      "capabilityIds": [
        "A-RECOVERY"
      ],
      "blockerRefs": [],
      "goal": "将已冻结 harness 应用于其余 production native writer 的真实 stage/validate/commit/re-read/crash 矩阵；BND4/FMG/PARAM 三格式 12 case 全部通过",
      "hardPrerequisites": "合法仓库外 native fixture registry 已建立；W-A-RECOVERY-HARNESS-02 已完成；未覆盖 writer 继续失败关闭",
      "entryPoints": [
        "对应 Bridge writer",
        "runNativeWriterFailureMatrixSmoke.ts",
        "Patch Engine"
      ],
      "requiredValidation": "npm run test:native-writer-failure-matrix、npm run test:private-native-gate 与对应 native transaction smoke",
      "declaresUnfrozenValidation": false
    },
    {
      "sliceId": "W-PARAM-META-01",
      "targetRelease": "V0.5",
      "lifecycle": "completed",
      "authority": "fixture-confirmed",
      "authorityCap": "partial",
      "authorityCapNote": "cap=partial；metadata contract，不提升 PARAM writer",
      "capabilityIds": [
        "C-PARAM"
      ],
      "blockerRefs": [],
      "goal": "已冻结 Paramdex-compatible metadata package、许可证 manifest、不可变来源、digest、五键匹配、精确 trust policy、display-only overlay、隔离快照、容量上限与冲突诊断契约",
      "hardPrerequisites": "不捆绑或再分发 Paramdex 数据；不把 metadata 当 native row document；本切片不要求私有 PARAM",
      "entryPoints": [
        "packages/shared/src/paramdef.ts",
        "packages/core/src/param/paramMetadata.ts",
        "packages/core/src/param/paramdefLayout.ts",
        "packages/core/src/testing/runParamMetadataMismatchSmoke.ts"
      ],
      "requiredValidation": "npm run test:param-metadata-mismatch、npm run test:paramdef-layout",
      "declaresUnfrozenValidation": false
    },
    {
      "sliceId": "W-PARAM-META-SOURCE-02",
      "targetRelease": "V0.5",
      "lifecycle": "completed",
      "authority": "partial",
      "authorityCap": "partial",
      "authorityCapNote": "cap=partial；只提升固定本机来源 adapter，不提升 native PARAM authority或上游再分发权利",
      "capabilityIds": [
        "C-PARAM"
      ],
      "blockerRefs": [],
      "goal": "已接入固定 Smithbox 2.2.4 本机发行包中的 SDT PARAM metadata，校验 commit/release/archive/tree/license digest、隔离导入、provenance、升级与撤回；不随 SoulForge 再分发导入数据",
      "hardPrerequisites": "W-PARAM-META-01 已完成；固定来源与非再分发政策已裁定；真实导入保持仓库外",
      "entryPoints": [
        "packages/core/src/testing/smithboxParamMetadataSource.ts",
        "packages/core/src/param/paramMetadata.ts"
      ],
      "requiredValidation": "npm run test:smithbox-param-metadata-source",
      "declaresUnfrozenValidation": false
    },
    {
      "sliceId": "W-PARAM-META-NATIVE-01",
      "targetRelease": "V0.5",
      "lifecycle": "completed",
      "authority": "partial",
      "authorityCap": "partial",
      "authorityCapNote": "cap=partial；只覆盖实际通过的注册 PARAM 布局",
      "capabilityIds": [
        "C-PARAM"
      ],
      "blockerRefs": [],
      "goal": "在合法注册 PARAM corpus 上验证 metadata 严格匹配、拒绝规则和 native row document 一致性；135/138 匹配、0 不一致、3 个已知旧布局正确排除",
      "hardPrerequisites": "metadata contract 与固定 Smithbox adapter 已完成；仓库外 PARAM fixture registry 已可用；剩余布局不得绕过",
      "entryPoints": [
        "bridge/SoulForge.Bridge/ParamNativeDocument.cs",
        "packages/core/src/testing/smithboxParamMetadataSource.ts",
        "native fixture registry"
      ],
      "requiredValidation": "npm run bridge:verify:param、npm run test:smithbox-param-metadata-source、npm run test:param-metadata-native",
      "declaresUnfrozenValidation": false
    },
    {
      "sliceId": "W-FIRSTPARTY-SCHEMA-01",
      "targetRelease": "V0.5",
      "lifecycle": "active",
      "authority": "candidate",
      "authorityCap": "partial",
      "authorityCapNote": "cap=partial；仅覆盖已内置并通过当前验证的 Sekiro 1.6.x schema；未覆盖或长度不匹配保持只读，Bridge 仍是 native authority",
      "capabilityIds": [
        "C-PARAM",
        "C-EMEVD"
      ],
      "blockerRefs": [],
      "goal": "解除生产运行时对 Smithbox/DarkScript3/Yapped 的依赖，随 SoulForge 发布自有版本化、内容寻址的 Sekiro 1.6.x PARAM/EMEVD schema；覆盖 160 个 PARAM definition、405 条 EMEVD 指令与 27 个 bank，覆盖缺口失败关闭",
      "hardPrerequisites": "第三方 adapter 仅可用于开发与交叉验证，不得进入生产入口或发布包；C# Bridge 继续是 native 格式 authority；drawparam/gparam 仍延期至 V0.6",
      "entryPoints": [
        "packages/core/src/schema/sekiro/firstPartySchema.ts",
        "packages/core/src/param/paramMetadata.ts",
        "packages/core/src/emevd/emedfRegistryResolver.ts",
        "apps/desktop/src/main/ipc/param.ts",
        "apps/desktop/src/main/ipc/event.ts",
        "scripts/verify-first-party-schema-boundary.mjs"
      ],
      "requiredValidation": {
        "steps": [
          {
            "suiteId": "test:first-party-schema-clean",
            "args": [],
            "env": {}
          },
          {
            "suiteId": "test:first-party-schema-boundary",
            "args": [],
            "env": {}
          },
          {
            "suiteId": "test:first-party-schema-package",
            "args": [],
            "env": {}
          },
          {
            "suiteId": "typecheck",
            "args": [],
            "env": {}
          },
          {
            "suiteId": "bridge:verify:synthetic",
            "args": [],
            "env": {}
          },
          {
            "suiteId": "test:first-party-schema-native-coverage",
            "args": [],
            "env": {}
          }
        ],
        "manualChecks": [
          "清空 LOCALAPPDATA、SOULFORGE_EMEDF_PATH、SOULFORGE_YAPPED_SDT_ROOT 后仍可读取内置 PARAM 字段和 EMEVD 源码",
          "真实 native corpus 可用时执行对应 PARAM/EMEVD smoke；未运行项保持 unverified/partial"
        ],
        "notes": "内置 schema loader 自动校验 origin、package/version、contentDigest 与覆盖计数；旧外部参数只返回 EMEVD_EXTERNAL_SCHEMA_FORBIDDEN，不扫描或读取外部路径。"
      },
      "declaresUnfrozenValidation": true
    },
    {
      "sliceId": "W-EMEVD-DSL-01",
      "targetRelease": "V0.5",
      "lifecycle": "completed",
      "authority": "fixture-confirmed",
      "authorityCap": "fixture-confirmed",
      "authorityCapNote": "cap=fixture-confirmed；Bridge/PatchIR 与完整控制流进入后继切片",
      "capabilityIds": [
        "C-EMEVD"
      ],
      "blockerRefs": [],
      "goal": "已建立稳定 anchor、DSL tokenizer/parser/AST、规范 patch render、EMEDF typecheck 与确定性 typed mutation plan；本切片验收边界已完成",
      "hardPrerequisites": "复用 emevd-editor-ir 与独立 emevd-dsl DTO；未知指令和不可无损重编码 payload 失败关闭/保持 opaque",
      "entryPoints": [
        "packages/shared/src/emevd-dsl.ts",
        "packages/core/src/emevd/dslTokenizer.ts",
        "packages/core/src/emevd/dslParser.ts",
        "packages/core/src/emevd/dslCompiler.ts",
        "packages/core/src/emevd/dslRenderer.ts",
        "packages/core/src/emevd/stableIdentity.ts"
      ],
      "requiredValidation": "npm run test:emevd-dsl-compiler、npm run test:emedf-schema、npm run test:emevd-four-view",
      "declaresUnfrozenValidation": false
    },
    {
      "sliceId": "W-EMEVD-PATCHIR-02",
      "targetRelease": "V0.5",
      "lifecycle": "completed",
      "authority": "partial",
      "authorityCap": "partial",
      "authorityCapNote": "cap=partial；production smoke 不证明完整 EMEDF/layer/游戏加载",
      "capabilityIds": [
        "C-EMEVD"
      ],
      "blockerRefs": [],